-2,Not applicable0,(Not classified)1,Associate's Colleges: High Transfer-High Traditional2,Associate's Colleges: High Transfer-Mixed Traditional/Nontraditional3,Associate's Colleges: High Transfer-High Nontraditional4,Associate's Colleges: Mixed Transfer/Vocational & Technical-High Traditional5,Associate's Colleges: Mixed Transfer/Vocational & Technical-Mixed Traditional/Nontraditional6,Associate's Colleges: Mixed Transfer/Vocational & Technical-High Nontraditional7,Associate's Colleges: High Vocational & Technical-High Traditional8,Associate's Colleges: High Vocational & Technical-Mixed Traditional/Nontraditional9,Associate's Colleges: High Vocational & Technical-High Nontraditional10,Special Focus Two-Year: Health Professions11,Special Focus Two-Year: Technical Professions12,Special Focus Two-Year: Arts & Design13,Special Focus Two-Year: Other Fields14,Baccalaureate/Associate's Colleges: Associate's Dominant15,Doctoral Universities: Highest Research Activity16,Doctoral Universities: Higher Research Activity17,Doctoral Universities: Moderate Research Activity18,Master's Colleges & Universities: Larger Programs19,Master's Colleges & Universities: Medium Programs20,Master's Colleges & Universities: Small Programs21,Baccalaureate Colleges: Arts & Sciences Focus22,Baccalaureate Colleges: Diverse Fields23,Baccalaureate/Associate's Colleges: Mixed Baccalaureate/Associate's24,Special Focus Four-Year: Faith-Related Institutions25,Special Focus Four-Year: Medical Schools & Centers26,Special Focus Four-Year: Other Health Professions Schools27,Special Focus Four-Year: Engineering Schools28,Special Focus Four-Year: Other Technology-Related Schools29,Special Focus Four-Year: Business & Management Schools30,"Special Focus Four-Year: Arts, Music & Design Schools"31,Special Focus Four-Year: Law Schools32,Special Focus Four-Year: Other Special Focus Institutions33,Tribal Colleges